리뷰,평점
"동해바다를 만끽할 수 있는 태종대!!

한국 관광객도 많지만, 특히나 외국 관광객들이 많이 오는 곳..
우리는 시간이 없어서 직접 산책을 하지는 못하고, 차를 타고 이동을 했지만, 주변 경관과 바다소리 등이 너무 좋았던 곳..
저녁에 가면 일몰도 볼 수 있는 곳..
전망대로 가면 분위기 있는 곳에서 맛있는 커피한잔을 할수가 있어서 너무 좋았음!

* 주차료: 4,000원(선불)
* 산책 코스: 2시간 정도
* 9월부터는 바다바람이 차기 때문에 반팔은 지양
* 전망대 근처에 가페가 있음",5.0
배경 끝내줌 기차타면서 돌아다니고 시원한 바람맞으면서 전망대에있는 까페에서 퓽경바라보면 최고,5.0
"8번버스타고 종점까지가면 태종대에서 내려요.
근데 어디서 출발하건 이동하는데 좀 걸린다는게 좀 아쉬웠어요.
적어도 오후4시 전에는 도착하시는게 좋아요 그 이후에는 태종대에서 운영하는 다누비 열차를 못탈수도 있어요!
다누비 열차는 전망대 등대 광장을 들리는데 다 전망대와 등대는 가까워서 전망대에서 내리고 등대까진 걸어가셔서 다시 다누비 열차를 타셔도 돼요.",5.0
"바람 엄청 엄청 엄청 불어요..ㅋㅋㅋ
진짜 날아가는 줄 알았어요. 위험하니까 너무 끝까지 가지 마세요ㅜㅜ
여자분들 치마도 절대 금물..
근데 경치도 너무 좋고 장관이었습니다! 부산에서 가장 기억남는 곳이에요",4.0
도보 걸어갈수 있으나 시간적 여유가 좀 안되신다면 코끼리 열차를 타서 갈수도 있고 정상에는 정말이지 시원한 바다바람을 즐길수 있었서 좋았네여~~,4.0
6월말이면 엄청 예쁜 수국이 만개할거예요. 저는 6월 중순쯤이라 아직 덜 핀 수국이 많아서 조금 아쉬웠어요. 근데 날씨가 너무 좋고 다누비 열차도 귀엽고 ㅎㅎ 살짝 등산 아닌 등산을 하긴 해야하지만 산과 바다를 동시에 볼 수 있어서 좋았어요.,5.0
"저희가 태종대 갔을때는 연휴기간이라 다누비 열차 줄이 무지 길었어요 걸어가면 30분 열차 기다리는시간은 한시간이랬는데 그래도 왔으니까 함 타보자고 기다렸는데 별로 볼것도 없고 차라리 걸어갔으면 천천히 구경하면서 가면 괜찮았겠다 싶더라구요 (열차는 성인 3천원입니다)
열차 표 구입할때 표에 번호가 찍혀나와서 줄서봤자 쓸데없고 순서되길 기다려야해요
내려올때도 한참 기다렸다는 ㅎㅎ
올라가서 레스토랑에서 브런치를 시켜먹었는데 전망대 레스토랑은 추천입니다 뷰가 이쁘고 음식도 맛있었어요 ㅎㅎ
열차때문에 기다리지만 않았음 좋았었을거같은 곳이예요",3.0
"어릴 적에도 가보고 그 기억에 또 방문하게 되었네요.
워낙 오래된 곳이라 크게 매력적이진 않습니다만, 바다 전망과 푸른 공원을 거니는 기분이 좋네요.
예전에는 신혼여행지였을 정도로 유명한 곳.",3.0
"태종대에서...가볍게 드라이브하려고 하다가 방문한 태종대..

이번에 구매한 망원렌즈로 지나가는 갈매기를 촬영해보았슴...ㅎㅎ

날이 너무좋아서. 날이 좋지 않아서. 날이 적당해서...좋은 날이었는데....",5.0
출장가서 직원들과 회식하기 위해 태종대 해변에서 바다에 발담그고 조개구이 먹었습니다. 카드결제는 안됩니다.,3.0
열차 대신 한바퀴 산책 겸 둘러 볼 수 있다. 전망대 밑으로 내려가서는 신선한 해산물에 술 한잔 할 수 있는 곳.,4.0
"부산역에서 도심리무진버스를 타고 가 볼수도있는 부산의 관광지입니다

나무와 바다가 이루어진 바위절경이 좋습니다
입구에서 주차하고 걸어가보는것도 좋을것같습니다.

특히 전망대인 자살바위쪽이 관광의 키포인트입니다",4.0
"사람이 많을 낮시간 보다는
아침일찍이 한바퀴도시는거 추천할께요
아무래도 관광지이다 보니 사람이 몰리면 태종대의 고즈넉한 나무향기와 파도소리를
잘 못들으실꺼예요
아침일찍가면 운동하시는 분들도 있고
꽃향기 나무향기에 바람도 솔솔 불고 참으로 좋습니다",5.0
생각보다 춥지도 않고 맑아서 겨울인데도 봏앟어요. 한 십년전에 친구들이랑 왓을때도 겨울이옷는데 태종대는 그대로 인득. 다만 그 회떠주믄집 멍게랑 개불 같은거 가격이 깡패임. 그냥 안먹고 나와서 횟집을 가는게 나음,3.0
"태종대의 멋진풍경은 밤과 낮모두입니다.
공원산책로가 매우잘되어있고 길거리 먹거리도 아주좋았습니다
바람이많이불었지만 여름에가기 시원한 여행지입니다
자갈마당의 조개구이도 맛있었습니다",5.0
"앞 바다엔 오륙도 빼곤 망망대해라서
조금 심심한 편이지만
해안가에 둘러진 도로를 따라 일주하다 보면
깎아지른 절벽이 아름다운 곳
영도 끝자락에 있어 시간이 많이 걸리는 것이
조금 단점.",4.0
